{
  "schema_version": "2.0",
  "operation_id": "OPR-001",
  "generated_at": "2026-12-31T23:40:00-08:00",
  "reserved_fixture_ids": ["FIX-001"],
  "source_snapshot": [
    {
      "path": "data/operation.json",
      "sha256": "c9967efa569a843bc6dccfe9eefd8659469fc40f9730c1dc920415c0336dfb75"
    },
    {
      "path": "data/events.json",
      "sha256": "49fe0593f3e9ddaff84361b0dec50f950a13b189ad09c4e582b80a624ee06509"
    },
    {
      "path": "data/exceptions.json",
      "sha256": "c874f238d88c4a4493a3202a7c8c61f21a8781e8472dc5d970662c6164a11779"
    }
  ],
  "coverage": {
    "fixture_count": 60,
    "workflow_instances": 50,
    "workflow_families": 10,
    "events": 426,
    "record_instances": 506,
    "exception_histories": 25,
    "operational_chains": 4,
    "overlays": 9,
    "offline_fixtures": 6,
    "conflict_fixtures": 7,
    "category_counts": {
      "blocked": 3,
      "conflict": 7,
      "correction": 10,
      "offline_delayed": 6,
      "routine": 34
    }
  },
  "fixtures": [
    {
      "id": "FIX-002",
      "title": "WFI-0001 · Seasonal planning, dispatch, execution, and verification — BLK-001 season case 1",
      "focus_kind": "workflow_instance",
      "selection_reason": "One deterministic fixture is retained for every full-season workflow instance so scenario coverage cannot silently omit an operational case.",
      "category": "offline_delayed",
      "state_flags": ["blocked", "exception", "historical", "offline"],
      "workflow_id": "WF-001",
      "workflow_instance_id": "WFI-0001",
      "current_state": "verified",
      "anchor": {
        "event_id": "EVT-00007",
        "transition_id": "TRN-WF-001-001",
        "from_state": null,
        "to_state": "observed",
        "semantic_kind": "observation",
        "actor_assignment_id": "ASG-002",
        "occurred_at": "2026-01-04T06:00:00-08:00",
        "record_reads": [],
        "record_writes": [],
        "decision_ids": [],
        "exception_history_ids": [],
        "connectivity": {
          "mode": "offline",
          "captured_offline": true,
          "sync_status": "synced"
        }
      },
      "event_ids": [
        "EVT-00007",
        "EVT-00009",
        "EVT-00011",
        "EVT-00013",
        "EVT-00015",
        "EVT-00017",
        "EVT-00019",
        "EVT-00021",
        "EVT-00023",
        "EVT-00025",
        "EVT-00027",
        "EVT-00029"
      ],
      "record_instance_ids": [
        "RCI-00001",
        "RCI-00002",
        "RCI-00003",
        "RCI-00004",
        "RCI-00005",
        "RCI-00006",
        "RCI-00007"
      ],
      "exception_history_ids": ["EXH-0001"],
      "operational_chain_ids": [],
      "overlay_ids": ["OVL-001", "OVL-002", "OVL-003", "OVL-005", "OVL-006"],
      "block_ids": ["BLK-001"],
      "contract_ids": ["CON-003"],
      "actor_assignment_ids": ["ASG-001", "ASG-002", "ASG-003", "ASG-004"],
      "started_at": "2026-01-04T06:00:00-08:00",
      "completed_at": "2026-01-09T18:00:00-08:00"
    },
    {
      "id": "FIX-003",
      "title": "WFI-0002 · Seasonal planning, dispatch, execution, and verification — BLK-002 season case 2",
      "focus_kind": "workflow_instance",
      "selection_reason": "One deterministic fixture is retained for every full-season workflow instance so scenario coverage cannot silently omit an operational case.",
      "category": "routine",
      "state_flags": ["exception", "historical", "partial"],
      "workflow_id": "WF-001",
      "workflow_instance_id": "WFI-0002",
      "current_state": "verified",
      "anchor": {
        "event_id": "EVT-00062",
        "transition_id": "TRN-WF-001-019",
        "from_state": "in_progress",
        "to_state": "partially_completed",
        "semantic_kind": "exception",
        "actor_assignment_id": "ASG-003",
        "occurred_at": "2026-03-10T06:00:00-07:00",
        "record_reads": ["RCI-00011", "RCI-00012", "RCI-00013"],
        "record_writes": ["RCI-00010", "RCI-00013", "RCI-00014"],
        "decision_ids": ["DEC-003"],
        "exception_history_ids": ["EXH-0002"],
        "connectivity": {
          "mode": "online",
          "captured_offline": false,
          "sync_status": "synced"
        }
      },
      "event_ids": [
        "EVT-00050",
        "EVT-00053",
        "EVT-00055",
        "EVT-00057",
        "EVT-00059",
        "EVT-00061",
        "EVT-00062",
        "EVT-00063",
        "EVT-00064"
      ],
      "record_instance_ids": [
        "RCI-00008",
        "RCI-00009",
        "RCI-00010",
        "RCI-00011",
        "RCI-00012",
        "RCI-00013",
        "RCI-00014"
      ],
      "exception_history_ids": ["EXH-0002"],
      "operational_chain_ids": [],
      "overlay_ids": ["OVL-001", "OVL-002", "OVL-003", "OVL-005", "OVL-006"],
      "block_ids": ["BLK-002"],
      "contract_ids": ["CON-003"],
      "actor_assignment_ids": ["ASG-001", "ASG-002", "ASG-003", "ASG-004"],
      "started_at": "2026-03-07T06:00:00-08:00",
      "completed_at": "2026-03-11T06:00:00-07:00"
    },
    {
      "id": "FIX-004",
      "title": "WFI-0003 · Seasonal planning, dispatch, execution, and verification — BLK-009 season case 3",
      "focus_kind": "workflow_instance",
      "selection_reason": "One deterministic fixture is retained for every full-season workflow instance so scenario coverage cannot silently omit an operational case.",
      "category": "correction",
      "state_flags": ["corrected", "exception", "historical"],
      "workflow_id": "WF-001",
      "workflow_instance_id": "WFI-0003",
      "current_state": "verified",
      "anchor": {
        "event_id": "EVT-00121",
        "transition_id": "TRN-WF-001-020",
        "from_state": "completed",
        "to_state": "correction_required",
        "semantic_kind": "exception",
        "actor_assignment_id": "ASG-003",
        "occurred_at": "2026-05-13T18:00:00-07:00",
        "record_reads": ["RCI-00018", "RCI-00019", "RCI-00020"],
        "record_writes": ["RCI-00017", "RCI-00020", "RCI-00021"],
        "decision_ids": ["DEC-003"],
        "exception_history_ids": ["EXH-0003"],
        "connectivity": {
          "mode": "online",
          "captured_offline": false,
          "sync_status": "synced"
        }
      },
      "event_ids": [
        "EVT-00107",
        "EVT-00109",
        "EVT-00111",
        "EVT-00113",
        "EVT-00115",
        "EVT-00117",
        "EVT-00119",
        "EVT-00121",
        "EVT-00123",
        "EVT-00125"
      ],
      "record_instance_ids": [
        "RCI-00015",
        "RCI-00016",
        "RCI-00017",
        "RCI-00018",
        "RCI-00019",
        "RCI-00020",
        "RCI-00021"
      ],
      "exception_history_ids": ["EXH-0003"],
      "operational_chain_ids": [],
      "overlay_ids": ["OVL-001", "OVL-002", "OVL-003", "OVL-005", "OVL-006"],
      "block_ids": ["BLK-009"],
      "contract_ids": ["CON-001", "CON-003"],
      "actor_assignment_ids": ["ASG-001", "ASG-002", "ASG-003", "ASG-004"],
      "started_at": "2026-05-10T06:00:00-07:00",
      "completed_at": "2026-05-14T18:00:00-07:00"
    },
    {
      "id": "FIX-005",
      "title": "WFI-0004 · Seasonal planning, dispatch, execution, and verification — BLK-010 season case 4",
      "focus_kind": "workflow_instance",
      "selection_reason": "One deterministic fixture is retained for every full-season workflow instance so scenario coverage cannot silently omit an operational case.",
      "category": "routine",
      "state_flags": ["historical"],
      "workflow_id": "WF-001",
      "workflow_instance_id": "WFI-0004",
      "current_state": "verified",
      "anchor": {
        "event_id": "EVT-00188",
        "transition_id": "TRN-WF-001-008",
        "from_state": "completed",
        "to_state": "verified",
        "semantic_kind": "verification",
        "actor_assignment_id": "ASG-001",
        "occurred_at": "2026-07-16T18:00:00-07:00",
        "record_reads": [],
        "record_writes": [],
        "decision_ids": [],
        "exception_history_ids": [],
        "connectivity": {
          "mode": "online",
          "captured_offline": false,
          "sync_status": "synced"
        }
      },
      "event_ids": [
        "EVT-00165",
        "EVT-00168",
        "EVT-00171",
        "EVT-00176",
        "EVT-00178",
        "EVT-00180",
        "EVT-00182",
        "EVT-00188"
      ],
      "record_instance_ids": [
        "RCI-00022",
        "RCI-00023",
        "RCI-00024",
        "RCI-00025",
        "RCI-00026",
        "RCI-00027",
        "RCI-00028"
      ],
      "exception_history_ids": [],
      "operational_chain_ids": [],
      "overlay_ids": ["OVL-001", "OVL-002", "OVL-003", "OVL-005", "OVL-006"],
      "block_ids": ["BLK-010"],
      "contract_ids": ["CON-001", "CON-003"],
      "actor_assignment_ids": ["ASG-001", "ASG-002", "ASG-003", "ASG-004"],
      "started_at": "2026-07-13T06:00:00-07:00",
      "completed_at": "2026-07-16T18:00:00-07:00"
    },
    {
      "id": "FIX-006",
      "title": "WFI-0005 · Seasonal planning, dispatch, execution, and verification — BLK-005 season case 5",
      "focus_kind": "workflow_instance",
      "selection_reason": "One deterministic fixture is retained for every full-season workflow instance so scenario coverage cannot silently omit an operational case.",
      "category": "routine",
      "state_flags": ["historical"],
      "workflow_id": "WF-001",
      "workflow_instance_id": "WFI-0005",
      "current_state": "verified",
      "anchor": {
        "event_id": "EVT-00400",
        "transition_id": "TRN-WF-001-008",
        "from_state": "completed",
        "to_state": "verified",
        "semantic_kind": "verification",
        "actor_assignment_id": "ASG-001",
        "occurred_at": "2026-11-19T18:00:00-08:00",
        "record_reads": [],
        "record_writes": [],
        "decision_ids": [],
        "exception_history_ids": [],
        "connectivity": {
          "mode": "online",